{
  "formatVersion": "0.1",
  "id": "view-be0a01d0a852",
  "title": "ResearchPerspectives::byRole",
  "notation": "source-declarations",
  "sources": [
    {
      "id": "source-0",
      "uri": "experiment.sysml",
      "revision": "sha256:9d6707c94f07c373267621a49808d3595fe4da69f9172a5fdcc548ac874dae77"
    },
    {
      "id": "source-1",
      "uri": "perspectives.sysml",
      "revision": "sha256:c904e02cf278f08fadd44b918f1afcf6060a05f43cd36ad1eb6d3392c3824dbc"
    },
    {
      "id": "source-2",
      "uri": "structure.sysml",
      "revision": "sha256:e4c89904cf64d284a8e99c7e2dc50e880480f1b22162efc799830ea14add6511"
    },
    {
      "id": "source-3",
      "uri": "types.sysml",
      "revision": "sha256:b14f23a2ad2b0ba38c9a13fba46a89fde70eda06e7d1b808b4dc95c596fd359c"
    },
    {
      "id": "source-4",
      "uri": "views.sysml",
      "revision": "sha256:d7c4daa56b5146ab98bc6c64d5b4c342917a1e7b198ea948d89f585272469492"
    }
  ],
  "nodes": [
    {
      "id": "node-0",
      "label": "part NativeNetwork::Transformer::tokens : Source",
      "symbol": "source.element",
      "bounds": [
        40.0,
        40,
        424,
        80
      ],
      "compartments": [],
      "modelRef": {
        "source": "source-2",
        "element": "span:9:9:9:30"
      }
    },
    {
      "id": "node-1",
      "label": "part NativeNetwork::Transformer::tokenEmbedding : Transform",
      "symbol": "source.element",
      "bounds": [
        584.0,
        40,
        512,
        80
      ],
      "compartments": [],
      "modelRef": {
        "source": "source-2",
        "element": "span:10:9:10:41"
      }
    },
    {
      "id": "node-2",
      "label": "part NativeNetwork::Transformer::positionEmbedding : Source",
      "symbol": "source.element",
      "bounds": [
        1216.0,
        40,
        512,
        80
      ],
      "compartments": [],
      "modelRef": {
        "source": "source-2",
        "element": "span:11:9:11:41"
      }
    },
    {
      "id": "node-3",
      "label": "part NativeNetwork::Transformer::embeddingAdd : Add",
      "symbol": "source.element",
      "bounds": [
        60.0,
        220,
        448,
        80
      ],
      "compartments": [],
      "modelRef": {
        "source": "source-2",
        "element": "span:12:9:12:33"
      }
    },
    {
      "id": "node-4",
      "label": "part NativeNetwork::Transformer::attention : Transform",
      "symbol": "source.element",
      "bounds": [
        628.0,
        220,
        472,
        80
      ],
      "compartments": [],
      "modelRef": {
        "source": "source-2",
        "element": "span:13:9:13:36"
      }
    },
    {
      "id": "node-5",
      "label": "part NativeNetwork::Transformer::attentionResidual : Add",
      "symbol": "source.element",
      "bounds": [
        1220.0,
        220,
        488,
        80
      ],
      "compartments": [],
      "modelRef": {
        "source": "source-2",
        "element": "span:14:9:14:38"
      }
    },
    {
      "id": "node-6",
      "label": "part NativeNetwork::Transformer::mlp : Transform",
      "symbol": "source.element",
      "bounds": [
        68.0,
        400,
        424,
        80
      ],
      "compartments": [],
      "modelRef": {
        "source": "source-2",
        "element": "span:15:9:15:30"
      }
    },
    {
      "id": "node-7",
      "label": "part NativeNetwork::Transformer::mlpResidual : Add",
      "symbol": "source.element",
      "bounds": [
        612.0,
        400,
        440,
        80
      ],
      "compartments": [],
      "modelRef": {
        "source": "source-2",
        "element": "span:16:9:16:32"
      }
    },
    {
      "id": "node-8",
      "label": "part NativeNetwork::Transformer::outputProjection : Transform",
      "symbol": "source.element",
      "bounds": [
        1172.0,
        400,
        528,
        80
      ],
      "compartments": [],
      "modelRef": {
        "source": "source-2",
        "element": "span:17:9:17:43"
      }
    }
  ],
  "edges": [],
  "extensions": {
    "mbse-diagrams.native-view": {
      "view": "ResearchPerspectives::byRole",
      "kind": "tree",
      "stated": "render asTreeDiagram",
      "elements": {
        "n0": {
          "modelRef": {
            "source": "source-2",
            "element": "span:9:9:9:30"
          },
          "kind": "part",
          "name": "NativeNetwork::Transformer::tokens",
          "parent": "",
          "type": "Source",
          "presentation": "node-0"
        },
        "n1": {
          "modelRef": {
            "source": "source-2",
            "element": "span:10:9:10:41"
          },
          "kind": "part",
          "name": "NativeNetwork::Transformer::tokenEmbedding",
          "parent": "",
          "type": "Transform",
          "presentation": "node-1"
        },
        "n2": {
          "modelRef": {
            "source": "source-2",
            "element": "span:11:9:11:41"
          },
          "kind": "part",
          "name": "NativeNetwork::Transformer::positionEmbedding",
          "parent": "",
          "type": "Source",
          "presentation": "node-2"
        },
        "n3": {
          "modelRef": {
            "source": "source-2",
            "element": "span:12:9:12:33"
          },
          "kind": "part",
          "name": "NativeNetwork::Transformer::embeddingAdd",
          "parent": "",
          "type": "Add",
          "presentation": "node-3"
        },
        "n4": {
          "modelRef": {
            "source": "source-2",
            "element": "span:13:9:13:36"
          },
          "kind": "part",
          "name": "NativeNetwork::Transformer::attention",
          "parent": "",
          "type": "Transform",
          "presentation": "node-4"
        },
        "n5": {
          "modelRef": {
            "source": "source-2",
            "element": "span:14:9:14:38"
          },
          "kind": "part",
          "name": "NativeNetwork::Transformer::attentionResidual",
          "parent": "",
          "type": "Add",
          "presentation": "node-5"
        },
        "n6": {
          "modelRef": {
            "source": "source-2",
            "element": "span:15:9:15:30"
          },
          "kind": "part",
          "name": "NativeNetwork::Transformer::mlp",
          "parent": "",
          "type": "Transform",
          "presentation": "node-6"
        },
        "n7": {
          "modelRef": {
            "source": "source-2",
            "element": "span:16:9:16:32"
          },
          "kind": "part",
          "name": "NativeNetwork::Transformer::mlpResidual",
          "parent": "",
          "type": "Add",
          "presentation": "node-7"
        },
        "n8": {
          "modelRef": {
            "source": "source-2",
            "element": "span:17:9:17:43"
          },
          "kind": "part",
          "name": "NativeNetwork::Transformer::outputProjection",
          "parent": "",
          "type": "Transform",
          "presentation": "node-8"
        }
      },
      "ports": {},
      "endpoints": {},
      "projection": {
        "presentation": "declarations",
        "lost": [],
        "counts": {
          "selectedElements": 9,
          "drawnNodes": 9,
          "listedPorts": 0,
          "relationships": 0
        }
      },
      "engine": {
        "name": "OpenSysML",
        "version": "v0.10.1",
        "binarySHA256": "1469eb7516a439fc372bc99812bf8bb5b4d2fb1b7279af29b2f055d6edbd1134",
        "transport": "stdio JSON-RPC (upstream evaluation prototype)",
        "standardLibrary": "embedded in the selected executable",
        "modelHash": "3d4185ba758d50594ba8db3d7023332084f06c445ab70edf2cf0d8dbcd548695"
      }
    }
  }
}
