{
  "formatVersion": "0.1",
  "id": "view-838d83550ae1",
  "title": "NativeViews::baseline",
  "notation": "source-declarations",
  "sources": [
    {
      "id": "source-0",
      "uri": "experiment.sysml",
      "revision": "sha256:9d6707c94f07c373267621a49808d3595fe4da69f9172a5fdcc548ac874dae77"
    },
    {
      "id": "source-1",
      "uri": "perspectives.sysml",
      "revision": "sha256:c904e02cf278f08fadd44b918f1afcf6060a05f43cd36ad1eb6d3392c3824dbc"
    },
    {
      "id": "source-2",
      "uri": "structure.sysml",
      "revision": "sha256:e4c89904cf64d284a8e99c7e2dc50e880480f1b22162efc799830ea14add6511"
    },
    {
      "id": "source-3",
      "uri": "types.sysml",
      "revision": "sha256:b14f23a2ad2b0ba38c9a13fba46a89fde70eda06e7d1b808b4dc95c596fd359c"
    },
    {
      "id": "source-4",
      "uri": "views.sysml",
      "revision": "sha256:d7c4daa56b5146ab98bc6c64d5b4c342917a1e7b198ea948d89f585272469492"
    }
  ],
  "nodes": [
    {
      "id": "node-0",
      "label": "part NativeExperiment::baseline : Experiment",
      "symbol": "source.element",
      "bounds": [
        40.0,
        40,
        392,
        124
      ],
      "compartments": [
        {
          "name": "source declarations",
          "lines": [
            "attribute :>> modulus = 113;",
            "attribute :>> trainingSteps = 40000;"
          ]
        }
      ],
      "modelRef": {
        "source": "source-0",
        "element": "span:9:5:12:6"
      }
    }
  ],
  "edges": [],
  "extensions": {
    "mbse-diagrams.native-view": {
      "view": "NativeViews::baseline",
      "kind": "tree",
      "stated": "render asTreeDiagram",
      "elements": {
        "n0": {
          "modelRef": {
            "source": "source-0",
            "element": "span:9:5:12:6"
          },
          "kind": "part",
          "name": "NativeExperiment::baseline",
          "parent": "",
          "type": "Experiment",
          "presentation": "node-0"
        },
        "n1": {
          "modelRef": {
            "source": "source-0",
            "element": "span:10:9:10:37"
          },
          "kind": "attribute",
          "name": "modulus",
          "parent": "n0"
        },
        "n2": {
          "modelRef": {
            "source": "source-0",
            "element": "span:11:9:11:45"
          },
          "kind": "attribute",
          "name": "trainingSteps",
          "parent": "n0"
        }
      },
      "ports": {},
      "endpoints": {},
      "projection": {
        "presentation": "declarations",
        "lost": [
          "nested visual containment; engine parent bindings remain in metadata"
        ],
        "counts": {
          "selectedElements": 3,
          "drawnNodes": 1,
          "listedPorts": 0,
          "relationships": 0
        }
      },
      "engine": {
        "name": "OpenSysML",
        "version": "v0.10.1",
        "binarySHA256": "1469eb7516a439fc372bc99812bf8bb5b4d2fb1b7279af29b2f055d6edbd1134",
        "transport": "stdio JSON-RPC (upstream evaluation prototype)",
        "standardLibrary": "embedded in the selected executable",
        "modelHash": "3d4185ba758d50594ba8db3d7023332084f06c445ab70edf2cf0d8dbcd548695"
      }
    }
  }
}
